{
  "module": "ax_audioengine",
  "target_namespace": "ax",
  "cpp_namespace": "ax",
  "macro_judgement": "#if defined(AX_ENABLE_AUDIO) && (AX_TARGET_PLATFORM == AX_PLATFORM_ANDROID || AX_TARGET_PLATFORM == AX_PLATFORM_IOS || AX_TARGET_PLATFORM == AX_PLATFORM_MAC || defined(_WIN32) || AX_TARGET_PLATFORM == AX_PLATFORM_LINUX || AX_TARGET_PLATFORM == AX_PLATFORM_WASM)",
  "headers": [
    "%(axdir)s/axmol/audio/AudioEngine.h"
  ],
  "clang_flags": [],
  "classes": [
    "AudioEngine",
    "AudioProfile"
  ],
  "abstract_classes": [
    "AudioEngine"
  ],
  "classes_have_no_parents": [
    "AudioEngine",
    "AudioProfile"
  ],
  "base_classes_to_skip": [
    "Clonable"
  ],
  "fields": [
    {
      "class": "AudioProfile",
      "names": [
        "name",
        "maxInstances",
        "minDelay"
      ]
    }
  ],
  "skip": [
    {
      "class": "AudioEngine",
      "methods": [
        "setReverbProperties"
      ]
    }
  ],
  "rename_functions": [
    {
      "class": "AudioEngine",
      "method": "^end$",
      "luaName": "endToLua"
    }
  ],
  "rename_classes": []
}
