{
  "module": "ax_ui",
  "target_namespace": "axui",
  "cpp_namespace": "ax::ui",
  "cpp_chunks": 4,
  "macro_judgement": null,
  "headers": [
    "%(axdir)s/axmol/ui/CocosGUI.h"
  ],
  "clang_flags": [],
  "classes": [
    "Helper",
    "Widget",
    "LayoutGroup",
    "Button",
    "CheckBox",
    "ImageView",
    "Text",
    "TextAtlas",
    "TextBMFont",
    "LoadingBar",
    "Slider",
    "TextField",
    "ScrollView",
    "ListView",
    "PageView",
    "LayoutParameter",
    "LinearLayoutParameter",
    "RelativeLayoutParameter",
    "Rich.*",
    "HBox",
    "VBox",
    "RelativeBox",
    "Scale9Sprite",
    "EditBox",
    "LayoutComponent",
    "AbstractCheckButton",
    "RadioButton",
    "RadioButtonGroup",
    "InputField",
    "TabView",
    "TabHeader"
  ],
  "abstract_classes": [
    "Helper",
    "AbstractCheckButton"
  ],
  "classes_have_no_parents": [
    "Helper"
  ],
  "base_classes_to_skip": [],
  "skip": [
    {
      "class": "*",
      "methods": [
        "^visit$",
        "copyWith.*",
        "onEnter.*",
        "onExit.*",
        "^description$",
        "getObjectType",
        ".*HSV",
        "onAcc.*",
        "onKey.*",
        "onRegisterTouchListener",
        "(g|s)etDelegate"
      ]
    },
    {
      "class": "Widget",
      "methods": [
        "addCCSEventListener"
      ]
    },
    {
      "class": "LayoutParameter",
      "methods": [
        "(s|g)etMargin"
      ]
    },
    {
      "class": "RichText",
      "methods": [
        "setTagDescription",
        "removeTagDescription"
      ]
    },
    {
      "class": "Helper",
      "methods": [
        "get*"
      ]
    },
    {
      "class": "InputField",
      "methods": []
    }
  ],
  "rename_functions": [],
  "rename_classes": []
}
